{
  "input_version": 1,
  "invocation": {
    "caller": "user",
    "harness": "claude-code",
    "mode": "direct",
    "session_id": "session-example-1"
  },
  "report_only": true,
  "run_dir": "/work/example/run",
  "run_id": "handoff-0001",
  "station": {},
  "workspace": "/work/example/workspace"
}
